{
  "format_version": 1,
  "repository": "example-observatory/observatory",
  "branch": "main",
  "workflow": ".github/workflows/release.yml",
  "consumer": "observatory",
  "project_id": "21111111-1111-4111-8111-111111111111",
  "environment_id": "22222222-2222-4222-8222-222222222222",
  "schema": {
    "service_id": "23333333-3333-4333-8333-333333333333",
    "name": "observatory schema",
    "config": null,
    "root_directory": "/",
    "start_command": "python manage.py release_schema",
    "healthcheck_path": null,
    "restart_policy": "NEVER",
    "public_http": false
  },
  "application": {
    "service_id": "24444444-4444-4444-8444-444444444444",
    "name": "observatory application",
    "config": null,
    "root_directory": "/",
    "start_command": "gunicorn observatory.wsgi",
    "healthcheck_path": "/health/",
    "restart_policy": "ON_FAILURE",
    "public_http": true
  },
  "acl_policy": "observatory-acl-v1"
}
