{
  "format_version": 1,
  "repository": "example-bookshop/bookshop",
  "branch": "main",
  "workflow": ".github/workflows/release.yml",
  "consumer": "bookshop",
  "project_id": "11111111-1111-4111-8111-111111111111",
  "environment_id": "12222222-2222-4222-8222-222222222222",
  "schema": {
    "service_id": "13333333-3333-4333-8333-333333333333",
    "name": "bookshop schema",
    "config": null,
    "root_directory": "/",
    "start_command": "python manage.py release_schema",
    "healthcheck_path": null,
    "restart_policy": "NEVER",
    "public_http": false
  },
  "application": {
    "service_id": "14444444-4444-4444-8444-444444444444",
    "name": "bookshop application",
    "config": null,
    "root_directory": "/",
    "start_command": "gunicorn bookshop.wsgi",
    "healthcheck_path": "/health/",
    "restart_policy": "ON_FAILURE",
    "public_http": true
  },
  "acl_policy": "bookshop-acl-v1"
}
